{
  "$schema": "https://json-schema.org/draft/2020-12/schema",
  "$id": "https://raw.githubusercontent.com/HSolddog/haoxiguan/main/docs/schemas/sync-encrypted-object-v1.schema.json",
  "title": "Haoxiguan decoded sync AEAD envelope v1",
  "description": "JSON obtained after canonical Base64 decoding the opaque HTTP ciphertext string. The server transports that outer string; this object is the client envelope, not a new server API.",
  "type": "object",
  "required": [
    "v",
    "generation",
    "nonce",
    "ciphertext"
  ],
  "properties": {
    "v": {
      "type": "integer",
      "const": 1
    },
    "generation": {
      "type": "integer",
      "minimum": 1,
      "maximum": 1000000
    },
    "nonce": {
      "$ref": "https://raw.githubusercontent.com/HSolddog/haoxiguan/main/docs/schemas/backup-encrypted-v1.schema.json#/properties/crypto/properties/nonce"
    },
    "ciphertext": {
      "allOf": [
        {
          "$ref": "https://raw.githubusercontent.com/HSolddog/haoxiguan/main/docs/schemas/backup-encrypted-v1.schema.json#/properties/payload"
        }
      ],
      "maxLength": 174784,
      "description": "Canonical Base64 for 16..131088 cipher bytes; the maximum is exactly representable because 131088 is divisible by three. Authentication and available generation checks remain runtime."
    }
  },
  "additionalProperties": false,
  "$defs": {
    "wireString": {
      "type": "string",
      "minLength": 1,
      "maxLength": 350000,
      "pattern": "^(?:[A-Za-z0-9+/]{4})*(?:[A-Za-z0-9+/][AQgw]==|[A-Za-z0-9+/]{2}[AEIMQUYcgkosw048]=)?(?![\\s\\S])",
      "contentEncoding": "base64",
      "contentMediaType": "application/json",
      "contentSchema": {
        "$ref": "#"
      },
      "description": "SyncCrypto.encrypt return value and HTTP ciphertext. contentSchema/contentEncoding are annotations; a validator must explicitly decode UTF-8 JSON and validate the envelope."
    }
  }
}
