{
  "v": 1,
  "generation": 2,
  "nonce": "6UbWGwOA4D3XjI0CRh8uRGthYhAcqE2Q",
  "ciphertext": "CYxoWos75l4Nrlf4dPTbGrJ1iGQRRScg9Af0zWKsmi8ayrlVDjHcbiPMJJyVMGp1fbX/yZtFrUoU00TxZeKyzdSC+a6G2nXGREs11KYkZb7Lz14NVZ++wup0+Ru/rfBQmEuDVchohWvE21o64cZUwGgnX2U29HMWDOZxTxZwOH4PQ9babCHybzVw77BdvlW0iyQfiTwKa7bJ0YXHpOWqab9M8e8FfPnuQPrx6EQi9fPJJRovQEaE8AGSNMJ9qADgLXELq1w1iHLtD42BlLJO2K3yCIXiV0FZwlFHzSFaATDHreFGd4wngRSoE2lrnm1JyQs60+8505yBNyHNnR312kOY8/zdLQqq1YSNCpReey/CaRgc+BMP7vf/D9TyCn47BAHSeEBkXSwhkQFbjlQszekhMlc1gKoSVkhyblASAoCxKS+c4BvJQ0zMXj9GksHM4QI6D8WV8KYWdHDAt2BFlV2/UckzaH8LP+WifZG9+hWTZ+kNZ1j6rZz/5XJ8s0dzQLOsFNgiNZpMd8uh3NaPUtB4LVaLeHpp0Vt+cmUFGN0tNvLasXB+rZSJoEsWd/JMHKLllFj5Xp0XrhBb9jLnSPcQ3LTGUQaxI1UNaHiclD6UdqJn6PsVoRjPJD+58zzBs9l6u9QpUHch0WvuCBMpsnvQNRVIH3Anxv7hFfjXWugF54GhSeCIO+K1io/E7IEPd+n9RTphGp2oD+5//5TaRleQ2GnqU+C2oJFbW0IOXZFOZG7SInlprsC9zHYxNs0SnJi6vUajIoFDw3Ehn6ocJ/wS9y8mlst/Ui/QaaRICROicYp+/z/QiHrGqppDKRfxt5JPHhjwTRYKuCwqyZERuislg8WCEjhjRiF3iMA/CuUDrRuFYLNYkGsGcXItMrxWvNi2nyDaoQ6xpCdUH62YD02oMJ8MhA22z5+ZZqvTo8qcYRZJ21HnOqAVWwC2C759QpYZi9MF1iDzUOWcfmlJFuKeIipzHhbyxwkfudddwgK6/8dlTGNYHxE5A7dQ/fe/Ky7gZsyfpNKV4qKwMSrsnxe89OjESY2Yaoii/zQhKo/lVV84+XA6Wq42A8W0qVrj5zibeAERXndPRm9/nD1sNjgnW0ZpH1wQud5m8sQLrqd/1+g="
}
